pdf,mm_yyyy,company,amount,currency,adjudicadora,tipo,tramitacion,procedimiento,model,time
BOE-B-2017-42055.pdf,07-2017,Bayer S.L. Biomedica Div. H.S.L. Codisa L. S.L. Cook Es. S.A. Dextro Med. S.L. Eurogine S.L. Intersurgical Es. S.L. Medtronic I. S.A. Prod. Med. Medela S.L. Roche D. S.L. Sum. Med. Sanitarios S.A. Teleflex M. S.A. Vialta S.L.,953095.11,euros,Servicio Murciano de Salud,Suministros,Ordinaria,Abierto,llama3,502.85
BOE-B-2017-41334.pdf,07-2017,Aldro Energía y Soluciones S.L.,475368.12,euros,Ayuntamiento de Villaquilambre,Suministro,Ordinaria,Abierto,llama3,323.79
BOE-B-2017-44248.pdf,07-2017,Auzo Lagun Sociedad Cooperativa,958263.9,euros,Hernaniko Udaleko Zerbitzu Sozialak,Contrato de Servicios,None,None,llama3,298.05
BOE-B-2017-44209.pdf,07-2017,Señalizaciones y Balizamientos la Castellana S.A,1210000.0,euros,Junta de Extremadura Consejería de Economía e Infraestructuras,Suministro,Anticipada,Abierto,phi3,260.98
BOE-B-2017-42808.pdf,07-2017,Asociación Provincial de Personas con Discapacidad Verdiblanca,684511.52,euros,Agencia Estatal Consejo Superior de Investigaciones Científicas,Servicio,Ordinaria,Abierto,llama3,338.22
BOE-B-2017-42106.pdf,07-2017,Serveis Integrals de Finques Urbanes S.L.,186340.0,euros,Institut Català d'Investigació Química,Servicio,Ordinaria,Abierto,phi3,213.58
BOE-B-2017-43957.pdf,07-2017,Suministros Puerto y Bahía S.A.,135000.0,euros,Instituto Social de la Marina,Suministro,Ordinaria,Contrato derivado de Acuerdo Marco,llama3,336.35
BOE-B-2017-42321.pdf,07-2017,Edp Energía S.A,597717.66,euros,Excmo. Ayuntamiento de Cehegín (Murcia),Suministro,Ordinaria,Abierto,phi3,253.69